{
  "version": "1.0",
  "name": "keyboard_flow",
  "created_at": "2024-06-15T12:30:00Z",
  "steps": [
    {
      "step_id": 1,
      "action_type": "mouse_click",
      "parameters": {"x": 400, "y": 300},
      "delay_ms": 0
    },
    {
      "step_id": 2,
      "action_type": "type_text",
      "parameters": {"text": "你好世界"},
      "delay_ms": 50
    },
    {
      "step_id": 3,
      "action_type": "key_press",
      "parameters": {"key": "enter"},
      "delay_ms": 100
    }
  ]
}
